batting_team,game_date,inning_num,score_diff,launch_angle,launch_speed,batted_ball_type,scoring_window,estimated_runner_delay,runner_behavior,total_play_time,runner_time_from_2b,runner_speed,fielder_arm_strength,des
AZ,2024-09-15,10,0,31,100.5,fly_ball,3.205905051130717,2.8321203213993216,halfway,9.286986132211798,6.081081081081081,29.6,87.2,Eugenio Suárez singles on a sharp fly ball to right fielder Sal Frelick. Ketel Marte scores. Corbin Carroll to 3rd. Christian Walker to 2nd.
PHI,2024-04-13,9,0,20,104.6,line_drive,2.149048287360639,1.2,halfway,8.23012936844172,6.081081081081081,29.6,86.7,Nick Castellanos singles on a sharp line drive to center fielder Jack Suwinski. Whit Merrifield scores. Trea Turner to 3rd. Alec Bohm to 2nd.
BAL,2024-05-23,3,-1,22,105.3,line_drive,2.0247600398807046,0.6,halfway,8.044826929512812,6.0200668896321075,29.9,88.4,Adley Rutschman singles on a sharp line drive to right fielder Tommy Pham. Cedric Mullins scores. Jorge Mateo to 3rd. Gunnar Henderson to 2nd.
CWS,2024-09-11,3,-5,24,95.4,line_drive,1.9528689400811476,0.6,halfway,8.268658413765358,6.315789473684211,28.5,88.3,Bryan Ramos singles on a line drive to right fielder Jhonkensy Noel. Corey Julks to 3rd. Luis Robert Jr. to 2nd.
ATH,2024-09-06,4,0,22,103.5,line_drive,1.891126635818975,1.2,halfway,8.412865766253757,6.521739130434782,27.6,87.5,"JJ Bleday singles on a sharp line drive to right fielder Kerry Carpenter, deflected by center fielder Parker Meadows. Brent Rooker out at 2nd on the throw, right fielder Kerry Carpenter to shortstop Trey Sweeney. Lawrence Butler to 3rd. JJ Bleday to 2nd."
TOR,2024-06-16,5,0,24,107.2,line_drive,1.8326783356689829,0.6,halfway,8.975535478526126,7.142857142857143,25.2,86.3,Vladimir Guerrero Jr. singles on a line drive to left fielder Steven Kwan. Spencer Horwitz to 3rd. Davis Schneider to 2nd.
BOS,2024-08-11,6,-9,22,84.1,line_drive,1.5499885513214915,0.6,halfway,7.631069632402572,6.081081081081081,29.6,84.7,Masataka Yoshida singles on a line drive to center fielder Jake Meyers. David Hamilton scores. Jarren Duran to 3rd. Wilyer Abreu to 2nd.
PHI,2024-09-19,7,-6,21,104.1,line_drive,1.542857069997611,0.6,halfway,7.880885239011696,6.338028169014085,28.4,90.8,Brandon Marsh singles on a sharp line drive to right fielder Tyrone Taylor. J.T. Realmuto to 3rd.
COL,2024-07-01,10,0,18,94.3,line_drive,1.4546893365383768,0.6,halfway,7.598034046435988,6.143344709897611,29.3,89.7,Jake Cave singles on a line drive to center fielder Garrett Mitchell. Aaron Schunk scores. Brenton Doyle to 3rd. Nolan Jones to 2nd.
PIT,2024-08-14,9,-7,24,82.7,line_drive,1.3863977237530065,0.6,halfway,7.702187197437217,6.315789473684211,28.5,83.2,Isiah Kiner-Falefa singles on a line drive to right fielder David Peralta. Bryan De La Cruz scores. Michael A. Taylor to 3rd. Yasmani Grandal to 2nd.
TB,2024-05-17,7,3,19,83.0,line_drive,1.2908367148268791,0.6,halfway,7.331105171202718,6.040268456375839,29.8,83.7,Yandy Díaz singles on a line drive to center fielder Daulton Varsho. Ben Rortvedt scores. Jonny DeLuca to 3rd.
CLE,2024-06-27,6,1,21,81.8,line_drive,1.2562668297361865,0.6,halfway,7.484640532158332,6.228373702422146,28.9,84.1,Gabriel Arias singles on a line drive to center fielder Kyle Isbel. Andrés Giménez to 3rd.
MIL,2024-09-14,6,12,14,102.7,line_drive,1.2316897095365054,0.4,hesitated,7.333384624790742,6.101694915254237,29.5,80.3,Jake Bauers singles on a sharp line drive to center fielder Jake McCarthy. Garrett Mitchell to 3rd. Willy Adames to 2nd.
BOS,2024-08-12,10,0,21,97.6,line_drive,1.1613982767578843,0.6,halfway,7.828064943424551,6.666666666666667,,91.3,Rob Refsnyder singles on a line drive to center fielder Leody Taveras. Ceddanne Rafaela scores. Mickey Gasper to 3rd. Masataka Yoshida to 2nd.
CIN,2024-05-05,9,-11,15,96.0,line_drive,1.1571703472067103,0.6,halfway,7.15717034720671,6.0,30.0,,Jake Fraley singles on a line drive to center fielder Ryan McKenna. Will Benson scores. Elly De La Cruz to 3rd. Spencer Steer to 2nd.
SF,2024-06-10,10,0,21,103.5,line_drive,1.1515547893534954,0.6,halfway,7.995661253231822,6.844106463878327,26.3,84.6,Austin Slater singles on a sharp line drive to left fielder Joey Loperfido. Patrick Bailey scores. Michael Conforto to 3rd. Jorge Soler to 2nd.
SEA,2024-09-08,1,3,21,82.0,line_drive,1.150555119193279,0.6,halfway,7.378928821615425,6.228373702422146,28.9,86.9,Justin Turner singles on a line drive to center fielder Michael Siani. Luke Raley to 3rd.
CHC,2024-09-28,8,0,20,83.1,line_drive,1.0661682400051804,0.6,halfway,7.404196409019265,6.338028169014085,28.4,85.4,Isaac Paredes singles on a line drive to center fielder TJ Friedl. Dansby Swanson scores. Cody Bellinger to 3rd. Seiya Suzuki to 2nd.
CIN,2024-04-01,6,-2,22,82.6,line_drive,1.0658561258681178,0.6,halfway,7.448834849272373,6.382978723404255,28.2,88.1,Christian Encarnacion-Strand singles on a line drive to center fielder Brandon Marsh. Jonathan India scores. Spencer Steer to 3rd.
TB,2024-09-01,6,-3,18,85.6,line_drive,1.0363207191611101,0.6,halfway,7.056387608793218,6.0200668896321075,29.9,83.2,Brandon Lowe singles on a line drive to right fielder David Peralta. Jose Siri to 3rd. Yandy Díaz to 2nd.
COL,2024-08-29,4,-5,23,80.2,line_drive,1.0160767399469215,0.6,halfway,7.421770690124857,6.405693950177936,28.1,88.6,Sam Hilliard singles on a line drive to center fielder Derek Hill. Nolan Jones to 3rd.
LAA,2024-06-09,2,0,16,105.4,line_drive,1.0101848829541336,0.6,halfway,7.3482130519682185,6.338028169014085,28.4,88.9,Logan O'Hoppe singles on a sharp line drive to left fielder Mauricio Dubón. Kevin Pillar to 3rd.
SEA,2024-08-11,6,3,18,99.5,line_drive,0.9988768229568006,0.6,halfway,7.227250525378946,6.228373702422146,28.9,87.7,Leo Rivas singles on a line drive to right fielder Ben Gamel. Jorge Polanco scores. Luke Raley to 3rd. Josh Rojas to 2nd.
CHC,2024-04-16,7,-3,22,80.9,line_drive,0.9901562160199475,0.6,halfway,7.607803274843477,6.61764705882353,27.2,82.6,"D-backs challenged (catch or drop), call on the field was upheld: Dansby Swanson singles on a line drive to center fielder Corbin Carroll. Mike Tauchman to 3rd. Nico Hoerner to 2nd."
KC,2024-05-03,7,2,18,87.7,line_drive,0.9856450669293979,0.6,halfway,6.887284411191693,5.901639344262295,30.5,89.9,Vinnie Pasquantino singles on a line drive to right fielder Adolis García. Maikel Garcia scores. Bobby Witt Jr. to 3rd.
COL,2024-04-28,2,-2,23,80.1,line_drive,0.9811650019313589,0.6,halfway,7.386858952109295,6.405693950177936,28.1,85.3,Sean Bouchard singles on a line drive to right fielder Kyle Tucker. Elias Díaz scores. Nolan Jones to 3rd.
PIT,2024-03-29,2,0,23,80.4,line_drive,0.9808061377489299,0.6,halfway,7.455626281633822,6.474820143884892,27.8,90.3,Oneil Cruz singles on a line drive to left fielder Bryan De La Cruz.   Edward Olivares to 3rd.    Henry Davis to 2nd.
COL,2024-05-23,6,2,16,102.4,line_drive,0.9750839417399195,0.6,halfway,7.380777891917855,6.405693950177936,28.1,78.9,Jake Cave singles on a sharp line drive to right fielder Seth Brown. Ezequiel Tovar to 3rd.
TB,2024-09-22,7,0,14,109.6,line_drive,0.9738284377017026,0.4,hesitated,6.99389532733381,6.0200668896321075,29.9,84.5,José Caballero singles on a line drive to left fielder Davis Schneider. Jose Siri to 3rd.
CWS,2024-06-20,5,0,18,83.9,line_drive,0.9715937083170054,0.6,halfway,7.221593708317005,6.25,28.8,84.7,Andrew Vaughn singles on a line drive to center fielder Jake Meyers. Tommy Pham scores. Luis Robert Jr. to 3rd.
BAL,2024-10-01,5,0,22,82.7,line_drive,0.9653314278031901,0.6,halfway,7.656781241929584,6.691449814126394,26.9,84.1,Cedric Mullins singles on a line drive to center fielder Kyle Isbel. Ramón Urías to 3rd.
SEA,2024-03-28,1,0,21,82.3,line_drive,0.9449053692455038,0.6,halfway,7.0259864503265845,6.081081081081081,29.6,89.4,Jorge Polanco singles on a line drive to right fielder Tyler O'Neill. Julio Rodríguez to 3rd.
SF,2024-05-18,8,5,18,100.5,line_drive,0.93199272737772,0.6,halfway,7.360564155949149,6.428571428571429,28.0,86.4,LaMonte Wade Jr. singles on a sharp line drive to right fielder Jake Cave. Thairo Estrada to 3rd.
TB,2024-04-16,11,-1,18,87.1,line_drive,0.9037702451455365,0.6,halfway,7.355383148371343,6.451612903225807,27.9,,Isaac Paredes singles on a line drive to center fielder Aaron Hicks. Richie Palacios to 3rd.
BAL,2024-06-19,9,1,13,108.5,line_drive,0.8508429296420195,0.4,hesitated,6.870909819274127,6.0200668896321075,29.9,92.1,Ryan Mountcastle singles on a line drive to center fielder Alex Verdugo. Jorge Mateo to 3rd. Adley Rutschman to 2nd.
MIA,2024-09-26,12,0,14,104.9,line_drive,0.8386197136818874,0.4,hesitated,6.981964423579498,6.143344709897611,29.3,83.1,Jesús Sánchez singles on a sharp line drive to right fielder Trevor Larnach. Connor Norby to 3rd.
SF,2024-08-12,1,0,13,102.7,line_drive,0.8345472913082901,0.4,hesitated,6.83454729130829,6.0,30.0,90.7,Mark Canha singles on a sharp line drive to center fielder Ramón Laureano. Tyler Fitzgerald to 3rd.
MIA,2024-09-12,8,0,12,108.4,line_drive,0.7648363465395063,0.4,hesitated,6.908181056437117,6.143344709897611,29.3,86.2,Jake Burger singles on a sharp line drive to center fielder Jacob Young. Connor Norby to 3rd. Jonah Bride to 2nd.
BOS,2024-06-16,3,1,14,100.5,line_drive,0.7198883185275307,0.4,hesitated,6.842337298119368,6.122448979591837,29.4,84.7,Rob Refsnyder singles on a sharp line drive to left fielder Juan Soto. David Hamilton to 3rd.
KC,2024-08-16,6,1,14,90.5,line_drive,0.7092964491781606,0.4,hesitated,6.610935793440456,5.901639344262295,30.5,85.7,Vinnie Pasquantino singles on a line drive to right fielder Will Benson. Bobby Witt Jr. to 3rd.
